<?xml version="1.0" encoding="UTF-8"?>
<qr:qualityReport
  xmlns="eml://ecoinformatics.org/qualityReport"
  xmlns:qr="eml://ecoinformatics.org/qualityReport"
  xmlns:xsi="http://www.w3.org/2001/XMLSchema-instance"
  xsi:schemaLocation="eml://ecoinformatics.org/qualityReport http://svn.lternet.edu/svn/NIS/documents/schemas/quality/qualityReportSchema.xsd"
  >
  <creationDate>2012-01-19T11:48:42</creationDate>
  <packageId>knb-lter-lno.1957.1</packageId>
  <includeSystem>knb</includeSystem>
  <includeSystem>lter</includeSystem>
  <datasetReport>
  </datasetReport>
  <entityReport>
    <entityName>1_NoneSuchBugCount</entityName>
    <entityId>xyz</entityId>
    <qualityCheck qualityType="congruency" system="knb" statusType="error" >
      <identifier>onlineURLs</identifier>
      <name>Online URLs are live</name>
      <description>Check that online URLs return something</description>
      <expected>true</expected>
      <found>true</found>
      <status>valid</status>
      <explanation>Succeeded in accessing URL: <![CDATA[http://trachyte.lternet.edu:8080/test/NoneSuchBugCount.txt]]></explanation>
      <suggestion></suggestion>
      <reference></reference>
    </qualityCheck>
    <qualityCheck qualityType="metadata" system="knb" statusType="error" >
      <identifier>databaseTableCreated</identifier>
      <name>Create database table</name>
      <description>Status of creating a database table</description>
      <expected>A database table is expected to be generated from the EML attributes.</expected>
      <found>A database table was generated from the attributes description</found>
      <status>valid</status>
      <explanation>CREATE TABLE _1_NoneSuchBugCount(fld TEXT,year TIMESTAMP,sppm2 FLOAT);</explanation>
      <suggestion></suggestion>
      <reference></reference>
    </qualityCheck>
    <qualityCheck qualityType="data" system="knb" statusType="info" >
      <identifier>displayDownloadData</identifier>
      <name>Display some data</name>
      <description>Display the first row of data</description>
      <expected>One row of data should be displayed</expected>
      <found><![CDATA[Blue Field, 1998, 4.5]]></found>
      <status>info</status>
      <explanation></explanation>
      <suggestion></suggestion>
      <reference></reference>
    </qualityCheck>
    <qualityCheck qualityType="congruency" system="knb" statusType="error" >
      <identifier>dataLoadStatus</identifier>
      <name>Data load status</name>
      <description>Status of loading the data table into a database</description>
      <expected>No errors expected during data loading or data loading was not attempted for this data entity</expected>
      <found>The data table loaded successfully into a database</found>
      <status>valid</status>
      <explanation></explanation>
      <suggestion></suggestion>
      <reference></reference>
    </qualityCheck>
    <qualityCheck qualityType="congruency" system="knb" statusType="error" >
      <identifier>numberOfRecords</identifier>
      <name>Number of records check</name>
      <description>Compare number of records specified in metadata to number of records found in data</description>
      <expected>42</expected>
      <found>42</found>
      <status>valid</status>
      <explanation>The expected number of records (42) was found in the data table.</explanation>
      <suggestion></suggestion>
      <reference></reference>
    </qualityCheck>
  </entityReport>
</qr:qualityReport>
